{
  "version": 1,
  "id": "PL.TAURON_SPRZEDAZ.G12w",
  "label": "TAURON Sprzedaż - G12w",
  "presetType": "OFFER",
  "components": [
    {
      "kind": "ENERGY_PURCHASE",
      "componentId": "energy-purchase",
      "label": "Energia czynna"
    }
  ],
  "provider": {
    "id": "TAURON_SPRZEDAZ",
    "label": "TAURON Sprzedaż"
  },
  "tariffGroup": "G12w",
  "validFrom": null,
  "validTo": null,
  "currency": "PLN",
  "timezone": "Europe/Warsaw",
  "taxContext": {
    "jurisdiction": "PL",
    "customerClass": "HOUSEHOLD"
  },
  "energyPurchase": {
    "supplier": {
      "id": "TAURON_SPRZEDAZ",
      "label": "TAURON Sprzedaż"
    },
    "assumptions": [
      "billingCycle.anchor w szablonie jest wyłącznie deterministycznym założeniem do samodzielnej kompilacji presetu; CostPlan konfiguruje billingCycles niezależnie.",
      "Ceny sprzedaży energii są wartościami netto bez VAT, z uwzględnieniem akcyzy 5 zł/MWh."
    ],
    "sources": [
      {
        "title": "Taryfa TAURON Sprzedaż dla odbiorców z grup taryfowych G na 2026 r.",
        "url": "https://bip.ure.gov.pl/download/3/20340/TauronSprzedaz.pdf",
        "retrievedAt": "2026-09-24"
      }
    ]
  },
  "inputs": [
    {
      "id": "energy.DAY",
      "label": "Cena energii - Szczyt/Dzień",
      "type": "DECIMAL",
      "required": true,
      "targets": [
        "/components/0/pricePeriods/0/rate/rates/DAY"
      ],
      "unit": "PLN/kWh"
    },
    {
      "id": "energy.NIGHT",
      "label": "Cena energii - Pozaszczyt/Noc",
      "type": "DECIMAL",
      "required": true,
      "targets": [
        "/components/0/pricePeriods/0/rate/rates/NIGHT"
      ],
      "unit": "PLN/kWh"
    }
  ],
  "billingDefinitionTemplate": {
    "version": 1,
    "currency": "PLN",
    "timezone": "Europe/Warsaw",
    "billingCycle": {
      "anchor": "2026-01-01",
      "length": 1,
      "unit": "MONTH"
    },
    "components": [
      {
        "id": "energy-purchase",
        "kind": "ENERGY_PURCHASE",
        "category": "ENERGY",
        "taxTreatment": {
          "included": [
            "EXCISE"
          ]
        },
        "quantity": {
          "type": "ACTIVE_ENERGY_IMPORT",
          "strategy": "IMPORT_MINUS_EXPORT_CAP_ZERO",
          "periodInMinutes": 60
        },
        "selector": {
          "type": "WEEKLY_SCHEDULE",
          "timezone": "Europe/Warsaw",
          "rules": [
            {
              "zone": "NIGHT",
              "days": [
                "HOLIDAY"
              ],
              "time_ranges": [
                {
                  "from": "00:00",
                  "to": "24:00"
                }
              ],
              "priority": 100
            },
            {
              "zone": "NIGHT",
              "days": [
                "SAT",
                "SUN"
              ],
              "time_ranges": [
                {
                  "from": "00:00",
                  "to": "24:00"
                }
              ],
              "priority": 200
            },
            {
              "zone": "NIGHT",
              "days": [
                "MON"
              ],
              "time_ranges": [
                {
                  "from": "00:00",
                  "to": "06:00"
                }
              ],
              "priority": 500
            },
            {
              "zone": "NIGHT",
              "days": [
                "MON",
                "TUE",
                "WED",
                "THU",
                "FRI"
              ],
              "time_ranges": [
                {
                  "from": "22:00",
                  "to": "06:00"
                },
                {
                  "from": "13:00",
                  "to": "15:00"
                }
              ],
              "priority": 500
            },
            {
              "zone": "DAY",
              "days": [
                "MON",
                "TUE",
                "WED",
                "THU",
                "FRI"
              ],
              "time_ranges": [
                {
                  "from": "06:00",
                  "to": "13:00"
                },
                {
                  "from": "15:00",
                  "to": "22:00"
                }
              ],
              "priority": 500
            }
          ],
          "calendar": "PL_PUBLIC_HOLIDAYS"
        },
        "pricePeriods": [
          {
            "validFrom": null,
            "validTo": null,
            "rate": {
              "type": "ZONED",
              "rates": {
                "DAY": "0.6270",
                "NIGHT": "0.4180"
              },
              "unit": "PLN/kWh"
            }
          }
        ]
      }
    ]
  },
  "warnings": [],
  "source": {
    "title": "Taryfa TAURON Sprzedaż dla odbiorców z grup taryfowych G na 2026 r.",
    "url": "https://bip.ure.gov.pl/download/3/20340/TauronSprzedaz.pdf",
    "retrievedAt": "2026-09-24"
  }
}
