{
  "version": 1,
  "id": "PL.ENERGA_OPERATOR.G12.FIXED",
  "label": "Energa-Operator - G12 - opłaty stałe",
  "presetType": "TARIFF",
  "components": [
    {
      "kind": "DISTRIBUTION_FIXED",
      "componentId": "distribution-fixed-network",
      "label": "Dystrybucja stała"
    },
    {
      "kind": "DISTRIBUTION_FIXED",
      "componentId": "capacity-fee",
      "label": "Opłata mocowa"
    },
    {
      "kind": "DISTRIBUTION_FIXED",
      "componentId": "distribution-subscription",
      "label": "Opłata abonamentowa"
    }
  ],
  "provider": {
    "id": "ENERGA_OPERATOR",
    "label": "Energa-Operator"
  },
  "operator": {
    "id": "ENERGA_OPERATOR",
    "label": "Energa-Operator"
  },
  "tariffGroup": "G12",
  "validFrom": null,
  "validTo": null,
  "currency": "PLN",
  "timezone": "Europe/Warsaw",
  "taxContext": {
    "jurisdiction": "PL",
    "customerClass": "HOUSEHOLD"
  },
  "inputs": [
    {
      "id": "distribution.fixed.rate",
      "label": "Stały składnik sieciowy",
      "type": "DECIMAL",
      "required": true,
      "targets": [
        "/components/0/pricePeriods/0/rate/value"
      ],
      "unit": "PLN/month",
      "help": "1 faza: 14,35 zł netto/mies.; 3 fazy: 20,17 zł netto/mies. Sprawdź liczbę faz instalacji."
    },
    {
      "id": "capacity.rate.2024-H1",
      "label": "Opłata mocowa (2024-H1)",
      "type": "DECIMAL",
      "required": true,
      "targets": [
        "/components/1/pricePeriods/0/rate/value"
      ],
      "unit": "PLN/month",
      "help": "Stawka zależy od rocznego zużycia energii. Sprawdź próg właściwy dla tego okresu."
    },
    {
      "id": "distribution.subscription.rate.2024-H1",
      "label": "Opłata abonamentowa dystrybucyjna (2024-H1)",
      "type": "DECIMAL",
      "required": true,
      "targets": [
        "/components/2/pricePeriods/0/rate/value"
      ],
      "unit": "PLN/month",
      "help": "Stawka zależy od okresu rozliczeń i sposobu odczytu licznika; dane historyczne są szacunkowe."
    },
    {
      "id": "capacity.rate.2024-H2_2025-H1",
      "label": "Opłata mocowa (2024-H2_2025-H1)",
      "type": "DECIMAL",
      "required": true,
      "targets": [
        "/components/1/pricePeriods/1/rate/value"
      ],
      "unit": "PLN/month",
      "help": "Stawka zależy od rocznego zużycia energii. Sprawdź próg właściwy dla tego okresu."
    },
    {
      "id": "capacity.rate.2025-H2",
      "label": "Opłata mocowa (2025-H2)",
      "type": "DECIMAL",
      "required": true,
      "targets": [
        "/components/1/pricePeriods/2/rate/value"
      ],
      "unit": "PLN/month",
      "help": "Stawka zależy od rocznego zużycia energii. Sprawdź próg właściwy dla tego okresu."
    },
    {
      "id": "capacity.rate.2026-Q1_Q3",
      "label": "Opłata mocowa (2026-Q1_Q3)",
      "type": "DECIMAL",
      "required": true,
      "targets": [
        "/components/1/pricePeriods/3/rate/value"
      ],
      "unit": "PLN/month",
      "help": "Opłata mocowa 2026 wg zużycia rocznego: do 500 kWh – 4,29 zł; 500–1200 – 10,31 zł; 1200–2800 – 17,18 zł; powyżej 2800 – 24,05 zł netto/mies."
    },
    {
      "id": "distribution.subscription.rate.2026-Q4",
      "label": "Opłata abonamentowa dystrybucyjna (2026-Q4)",
      "type": "DECIMAL",
      "required": true,
      "targets": [
        "/components/2/pricePeriods/1/rate/value"
      ],
      "unit": "PLN/month",
      "help": "Od 1.10.2026 abonament dystrybucyjny wynosi 0 zł/mies."
    }
  ],
  "billingDefinitionTemplate": {
    "version": 1,
    "currency": "PLN",
    "timezone": "Europe/Warsaw",
    "billingCycle": {
      "anchor": "2026-01-01",
      "length": 1,
      "unit": "MONTH"
    },
    "components": [
      {
        "id": "distribution-fixed-network",
        "kind": "DISTRIBUTION_FIXED",
        "category": "NETWORK",
        "taxTreatment": {
          "included": []
        },
        "quantity": {
          "type": "PERIOD",
          "period": "MONTH",
          "prorate": false
        },
        "pricePeriods": [
          {
            "validFrom": null,
            "validTo": null,
            "rate": {
              "type": "CONSTANT",
              "value": "14.35",
              "unit": "PLN/month"
            }
          }
        ]
      },
      {
        "id": "capacity-fee",
        "kind": "DISTRIBUTION_FIXED",
        "category": "NETWORK",
        "taxTreatment": {
          "included": []
        },
        "quantity": {
          "type": "PERIOD",
          "period": "MONTH",
          "prorate": false
        },
        "pricePeriods": [
          {
            "validFrom": null,
            "validTo": "2024-07-01T00:00:00+02:00",
            "rate": {
              "type": "CONSTANT",
              "value": "10.64",
              "unit": "PLN/month"
            }
          },
          {
            "validFrom": "2024-07-01T00:00:00+02:00",
            "validTo": "2025-07-01T00:00:00+02:00",
            "rate": {
              "type": "CONSTANT",
              "value": "0.00",
              "unit": "PLN/month"
            }
          },
          {
            "validFrom": "2025-07-01T00:00:00+02:00",
            "validTo": "2026-01-01T00:00:00+01:00",
            "rate": {
              "type": "CONSTANT",
              "value": "11.44",
              "unit": "PLN/month"
            }
          },
          {
            "validFrom": "2026-01-01T00:00:00+01:00",
            "validTo": null,
            "rate": {
              "type": "CONSTANT",
              "value": "17.18",
              "unit": "PLN/month"
            }
          }
        ]
      },
      {
        "id": "distribution-subscription",
        "kind": "DISTRIBUTION_FIXED",
        "category": "NETWORK",
        "taxTreatment": {
          "included": []
        },
        "quantity": {
          "type": "PERIOD",
          "period": "MONTH",
          "prorate": false
        },
        "pricePeriods": [
          {
            "validFrom": null,
            "validTo": "2026-10-01T00:00:00+02:00",
            "rate": {
              "type": "CONSTANT",
              "value": "4.64",
              "unit": "PLN/month"
            }
          },
          {
            "validFrom": "2026-10-01T00:00:00+02:00",
            "validTo": null,
            "rate": {
              "type": "CONSTANT",
              "value": "0.00",
              "unit": "PLN/month"
            }
          }
        ]
      }
    ]
  },
  "warnings": [
    "Stawki sieciowe i abonamentowe za lata 2024–2025 są szacunkowe. Jeśli rozliczasz ten okres, sprawdź je na fakturze."
  ],
  "llmNotes": [
    "Domyślna opłata mocowa 17.18 PLN/mies. netto odpowiada zużyciu rocznemu powyżej 1200 kWh do 2800 kWh; ustaw stawkę właściwą dla swojego progu. Stawki 2026 wynikają z Informacji Prezesa URE nr 58/2025.",
    "Od 2026-10-01 opłata abonamentowa OSD jest ustawiona na 0.00 PLN/mies. zgodnie z § 56 ust. 3 rozporządzenia Ministra Energii z 3.09.2026 r. (Dz.U. 2026 poz. 1182); ewentualna opłata po stronie sprzedawcy nie jest modelowana przez ten preset.",
    "Opłata przejściowa nie jest dodawana: została zniesiona od 2026-01-01.",
    "Historyczne stawki opłaty mocowej dotyczą gospodarstwa domowego ze zużyciem rocznym >1200 do 2800 kWh. Opłata mocowa została ustawowo wyzerowana od 2024-07-01 do 2025-06-30; pozostałe kwoty są nominalnymi stawkami URE (netto).",
    "Historycznych stawek stałego składnika sieciowego i abonamentu za lata 2024-2025 nie potwierdzono dla tego wariantu; skopiowano domyślne wartości 2026 jako przybliżenie. W każdym okresie można je niezależnie nadpisać."
  ],
  "source": {
    "title": "Taryfa Energa-Operator na 2026 r.",
    "url": "https://cdn-netpr.pl/file/mediakit/2933024/8/20251217_taryfa_2026.pdf",
    "retrievedAt": "2026-09-30"
  },
  "sources": [
    {
      "title": "URE: stawki oplaty mocowej za lata 2024, 2025, 2026 (prog ponad 1200 do 2800 kWh, netto; 10.64, 11.44, 17.18 PLN/mies.)",
      "url": "https://www.ure.gov.pl/pl/energia-elektryczna/ceny-wskazniki/9165%2CStawki-oplaty-mocowej.html"
    },
    {
      "title": "Ustawa z 23.05.2024 r. o bonie energetycznym, art. 28: zawieszenie oplaty mocowej VII-XII 2024 (Dz.U. poz. 859)",
      "url": "https://eli.gov.pl/eli/DU/2024/859/ogl"
    },
    {
      "title": "Ustawa z 27.11.2024 r. (Dz.U. poz. 1831): oplata mocowa 0 PLN I-VI 2025",
      "url": "https://eli.gov.pl/eli/DU/2024/1831/ogl"
    }
  ]
}
