{
  "version": 1,
  "id": "PL.TAURON_DYSTRYBUCJA.G12w",
  "label": "TAURON Dystrybucja - G12w",
  "presetType": "TARIFF",
  "components": [
    {
      "kind": "DISTRIBUTION_VARIABLE",
      "componentId": "distribution-variable",
      "label": "Dystrybucja zmienna"
    }
  ],
  "provider": {
    "id": "TAURON_DYSTRYBUCJA",
    "label": "TAURON Dystrybucja"
  },
  "operator": {
    "id": "TAURON_DYSTRYBUCJA",
    "label": "TAURON Dystrybucja"
  },
  "tariffGroup": "G12w",
  "validFrom": null,
  "validTo": null,
  "currency": "PLN",
  "timezone": "Europe/Warsaw",
  "taxContext": {
    "jurisdiction": "PL",
    "customerClass": "HOUSEHOLD"
  },
  "inputs": [
    {
      "id": "distribution.DAY",
      "label": "Dystrybucja - Szczyt/Dzień",
      "type": "DECIMAL",
      "required": true,
      "targets": [
        "/components/0/pricePeriods/0/rate/rates/DAY"
      ],
      "unit": "PLN/kWh"
    },
    {
      "id": "distribution.NIGHT",
      "label": "Dystrybucja - Pozaszczyt/Noc",
      "type": "DECIMAL",
      "required": true,
      "targets": [
        "/components/0/pricePeriods/0/rate/rates/NIGHT"
      ],
      "unit": "PLN/kWh"
    }
  ],
  "billingDefinitionTemplate": {
    "version": 1,
    "currency": "PLN",
    "timezone": "Europe/Warsaw",
    "billingCycle": {
      "anchor": "2026-01-01",
      "length": 1,
      "unit": "MONTH"
    },
    "components": [
      {
        "id": "distribution-variable",
        "kind": "DISTRIBUTION_VARIABLE",
        "category": "NETWORK",
        "taxTreatment": {
          "included": []
        },
        "quantity": {
          "type": "ACTIVE_ENERGY_IMPORT",
          "strategy": "IMPORT_MINUS_EXPORT_CAP_ZERO",
          "periodInMinutes": 60
        },
        "selector": {
          "type": "WEEKLY_SCHEDULE",
          "timezone": "Europe/Warsaw",
          "rules": [
            {
              "zone": "NIGHT",
              "days": [
                "HOLIDAY"
              ],
              "time_ranges": [
                {
                  "from": "00:00",
                  "to": "24:00"
                }
              ],
              "priority": 100
            },
            {
              "zone": "NIGHT",
              "days": [
                "SAT",
                "SUN"
              ],
              "time_ranges": [
                {
                  "from": "00:00",
                  "to": "24:00"
                }
              ],
              "priority": 200
            },
            {
              "zone": "NIGHT",
              "days": [
                "MON"
              ],
              "time_ranges": [
                {
                  "from": "00:00",
                  "to": "06:00"
                }
              ],
              "priority": 500
            },
            {
              "zone": "NIGHT",
              "days": [
                "MON",
                "TUE",
                "WED",
                "THU",
                "FRI"
              ],
              "time_ranges": [
                {
                  "from": "22:00",
                  "to": "06:00"
                },
                {
                  "from": "13:00",
                  "to": "15:00"
                }
              ],
              "priority": 500
            },
            {
              "zone": "DAY",
              "days": [
                "MON",
                "TUE",
                "WED",
                "THU",
                "FRI"
              ],
              "time_ranges": [
                {
                  "from": "06:00",
                  "to": "13:00"
                },
                {
                  "from": "15:00",
                  "to": "22:00"
                }
              ],
              "priority": 500
            }
          ],
          "calendar": "PL_PUBLIC_HOLIDAYS"
        },
        "pricePeriods": [
          {
            "validFrom": null,
            "validTo": null,
            "rate": {
              "type": "ZONED",
              "rates": {
                "DAY": "0.3298",
                "NIGHT": "0.0512"
              },
              "unit": "PLN/kWh"
            }
          }
        ]
      }
    ]
  },
  "warnings": [],
  "source": {
    "title": "Taryfa TAURON Dystrybucja na 2026 r.",
    "url": "https://www.tauron-dystrybucja.pl/-/media/offer-documents/dystrybucja/aktualna-taryfa/taryfa-tauron-dystrybucja-2026_ocr.ashx",
    "retrievedAt": "2026-09-24"
  }
}
