{
  "version": 1,
  "id": "PL.STOEN_OPERATOR.G11",
  "label": "Stoen Operator - G11",
  "presetType": "TARIFF",
  "components": [
    {
      "kind": "DISTRIBUTION_VARIABLE",
      "componentId": "distribution-variable",
      "label": "Dystrybucja zmienna"
    }
  ],
  "provider": {
    "id": "STOEN_OPERATOR",
    "label": "Stoen Operator"
  },
  "operator": {
    "id": "STOEN_OPERATOR",
    "label": "Stoen Operator"
  },
  "tariffGroup": "G11",
  "validFrom": null,
  "validTo": null,
  "currency": "PLN",
  "timezone": "Europe/Warsaw",
  "taxContext": {
    "jurisdiction": "PL",
    "customerClass": "HOUSEHOLD"
  },
  "inputs": [
    {
      "id": "distribution.rate",
      "label": "Składnik zmienny dystrybucji",
      "type": "DECIMAL",
      "required": true,
      "targets": [
        "/components/0/pricePeriods/0/rate/value"
      ],
      "unit": "PLN/kWh"
    }
  ],
  "billingDefinitionTemplate": {
    "version": 1,
    "currency": "PLN",
    "timezone": "Europe/Warsaw",
    "billingCycle": {
      "anchor": "2026-01-01",
      "length": 1,
      "unit": "MONTH"
    },
    "components": [
      {
        "id": "distribution-variable",
        "kind": "DISTRIBUTION_VARIABLE",
        "category": "NETWORK",
        "taxTreatment": {
          "included": []
        },
        "quantity": {
          "type": "ACTIVE_ENERGY_IMPORT",
          "strategy": "IMPORT_MINUS_EXPORT_CAP_ZERO",
          "periodInMinutes": 60
        },
        "selector": {
          "type": "ALWAYS"
        },
        "pricePeriods": [
          {
            "validFrom": null,
            "validTo": null,
            "rate": {
              "type": "CONSTANT",
              "value": "0.2342",
              "unit": "PLN/kWh"
            }
          }
        ]
      }
    ]
  },
  "warnings": [],
  "source": {
    "title": "Taryfa Stoen Operator na 2026 r.",
    "url": "https://e-bok.stoen.pl/binsource?docId=8321&index=0&language=PL&paramName=BINARYOBJ_FILE",
    "retrievedAt": "2026-09-22"
  }
}
