{
  "version": 1,
  "id": "PL.ENERGA_OBROT.G12",
  "label": "ENERGA-OBRÓT - G12",
  "presetType": "OFFER",
  "components": [
    {
      "kind": "ENERGY_PURCHASE",
      "componentId": "energy-purchase",
      "label": "Energia czynna"
    }
  ],
  "provider": {
    "id": "ENERGA_OBROT",
    "label": "ENERGA-OBRÓT"
  },
  "tariffGroup": "G12",
  "validFrom": null,
  "validTo": null,
  "currency": "PLN",
  "timezone": "Europe/Warsaw",
  "taxContext": {
    "jurisdiction": "PL",
    "customerClass": "HOUSEHOLD"
  },
  "energyPurchase": {
    "supplier": {
      "id": "ENERGA_OBROT",
      "label": "ENERGA-OBRÓT"
    },
    "assumptions": [
      "billingCycle.anchor w szablonie jest wyłącznie deterministycznym założeniem do samodzielnej kompilacji presetu; CostPlan konfiguruje billingCycles niezależnie.",
      "Ceny sprzedaży energii są wartościami netto bez VAT, z uwzględnieniem akcyzy 5 zł/MWh."
    ],
    "sources": [
      {
        "title": "Taryfa ENERGA-OBRÓT dla odbiorców z grup taryfowych G na 2026 r.",
        "url": "https://www.energa.pl/dam/jcr%3A1f730159-7aab-4815-8a17-e0f6f0a6a223/Taryfa%20ENERGA-OBR%C3%93T%20S.A.%20dla%20energii%20elektrycznej%20obowi%C4%85zuj%C4%85ca%20od%201.01.pdf",
        "retrievedAt": "2026-09-23"
      },
      {
        "title": "ENERGA-OBROT SA, taryfa G 2024-2025 (zmiany 01.07.2024 i 01.10.2025; pkt 5.1, 5.2, 5.2.a)",
        "url": "https://nps.energa.pl/dam/jcr%3A38348edb-d43b-4d4e-92ed-54e7cf637b21/Taryfa%20ENERGA-OBR%C3%93T%20SA%20dla%20energii%20elektrycznej_V2%20obowi%C4%85zuj%C4%85ca%20od%2001.pdf",
        "retrievedAt": "2026-10-09"
      }
    ]
  },
  "inputs": [
    {
      "id": "energy.DAY.2024-H1",
      "label": "Cena energii - Dzień (2024-H1)",
      "type": "DECIMAL",
      "required": true,
      "targets": [
        "/components/0/pricePeriods/0/rate/rates/DAY"
      ],
      "unit": "PLN/kWh"
    },
    {
      "id": "energy.NIGHT.2024-H1",
      "label": "Cena energii - Noc (2024-H1)",
      "type": "DECIMAL",
      "required": true,
      "targets": [
        "/components/0/pricePeriods/0/rate/rates/NIGHT"
      ],
      "unit": "PLN/kWh"
    },
    {
      "id": "energy.DAY.2024-H2_2025-Q3",
      "label": "Cena energii - Dzień (2024-H2_2025-Q3)",
      "type": "DECIMAL",
      "required": true,
      "targets": [
        "/components/0/pricePeriods/1/rate/rates/DAY"
      ],
      "unit": "PLN/kWh"
    },
    {
      "id": "energy.NIGHT.2024-H2_2025-Q3",
      "label": "Cena energii - Noc (2024-H2_2025-Q3)",
      "type": "DECIMAL",
      "required": true,
      "targets": [
        "/components/0/pricePeriods/1/rate/rates/NIGHT"
      ],
      "unit": "PLN/kWh"
    },
    {
      "id": "energy.DAY.2025-Q4",
      "label": "Cena energii - Dzień (2025-Q4)",
      "type": "DECIMAL",
      "required": true,
      "targets": [
        "/components/0/pricePeriods/2/rate/rates/DAY"
      ],
      "unit": "PLN/kWh"
    },
    {
      "id": "energy.NIGHT.2025-Q4",
      "label": "Cena energii - Noc (2025-Q4)",
      "type": "DECIMAL",
      "required": true,
      "targets": [
        "/components/0/pricePeriods/2/rate/rates/NIGHT"
      ],
      "unit": "PLN/kWh"
    },
    {
      "id": "energy.DAY.2026",
      "label": "Cena energii - Dzień (2026)",
      "type": "DECIMAL",
      "required": true,
      "targets": [
        "/components/0/pricePeriods/3/rate/rates/DAY"
      ],
      "unit": "PLN/kWh"
    },
    {
      "id": "energy.NIGHT.2026",
      "label": "Cena energii - Noc (2026)",
      "type": "DECIMAL",
      "required": true,
      "targets": [
        "/components/0/pricePeriods/3/rate/rates/NIGHT"
      ],
      "unit": "PLN/kWh"
    }
  ],
  "billingDefinitionTemplate": {
    "version": 1,
    "currency": "PLN",
    "timezone": "Europe/Warsaw",
    "billingCycle": {
      "anchor": "2026-01-01",
      "length": 1,
      "unit": "MONTH"
    },
    "components": [
      {
        "id": "energy-purchase",
        "kind": "ENERGY_PURCHASE",
        "category": "ENERGY",
        "taxTreatment": {
          "included": [
            "EXCISE"
          ]
        },
        "quantity": {
          "type": "ACTIVE_ENERGY_IMPORT",
          "strategy": "IMPORT_MINUS_EXPORT_CAP_ZERO",
          "periodInMinutes": 60
        },
        "selector": {
          "type": "WEEKLY_SCHEDULE",
          "timezone": "Europe/Warsaw",
          "rules": [
            {
              "zone": "NIGHT",
              "days": [
                "MON",
                "TUE",
                "WED",
                "THU",
                "FRI",
                "SAT",
                "SUN"
              ],
              "time_ranges": [
                {
                  "from": "22:00",
                  "to": "06:00"
                },
                {
                  "from": "13:00",
                  "to": "15:00"
                }
              ]
            },
            {
              "zone": "DAY",
              "days": [
                "MON",
                "TUE",
                "WED",
                "THU",
                "FRI",
                "SAT",
                "SUN"
              ],
              "time_ranges": [
                {
                  "from": "06:00",
                  "to": "13:00"
                },
                {
                  "from": "15:00",
                  "to": "22:00"
                }
              ]
            }
          ]
        },
        "pricePeriods": [
          {
            "validFrom": null,
            "validTo": "2024-07-01T00:00:00+02:00",
            "rate": {
              "type": "ZONED",
              "rates": {
                "DAY": "0.8690",
                "NIGHT": "0.5650"
              },
              "unit": "PLN/kWh"
            }
          },
          {
            "validFrom": "2024-07-01T00:00:00+02:00",
            "validTo": "2025-10-01T00:00:00+02:00",
            "rate": {
              "type": "ZONED",
              "rates": {
                "DAY": "0.7333",
                "NIGHT": "0.4771"
              },
              "unit": "PLN/kWh"
            }
          },
          {
            "validFrom": "2025-10-01T00:00:00+02:00",
            "validTo": "2026-01-01T00:00:00+01:00",
            "rate": {
              "type": "ZONED",
              "rates": {
                "DAY": "0.6745",
                "NIGHT": "0.4390"
              },
              "unit": "PLN/kWh"
            }
          },
          {
            "validFrom": "2026-01-01T00:00:00+01:00",
            "validTo": null,
            "rate": {
              "type": "ZONED",
              "rates": {
                "DAY": "0.5839",
                "NIGHT": "0.3803"
              },
              "unit": "PLN/kWh"
            }
          }
        ]
      }
    ]
  },
  "warnings": [
    "Ceny historyczne są taryfowe; nie uwzględniają ustawowych limitów ani indywidualnych rabatów."
  ],
  "llmNotes": [
    "Ceny historyczne sa stawkami taryfowymi netto (bez VAT), zawierajacymi akcyze 0,005 PLN/kWh; nie sa cenami maksymalnymi ani zamrozonymi wynikajacymi z przepisow ochronnych."
  ],
  "source": {
    "title": "Taryfa ENERGA-OBRÓT dla odbiorców z grup taryfowych G na 2026 r.",
    "url": "https://www.energa.pl/dam/jcr%3A1f730159-7aab-4815-8a17-e0f6f0a6a223/Taryfa%20ENERGA-OBR%C3%93T%20S.A.%20dla%20energii%20elektrycznej%20obowi%C4%85zuj%C4%85ca%20od%201.01.pdf",
    "retrievedAt": "2026-09-23"
  }
}
