{
  "version": 1,
  "id": "PL.TAURON_DYSTRYBUCJA.G11",
  "label": "TAURON Dystrybucja - G11",
  "presetType": "TARIFF",
  "components": [
    {
      "kind": "DISTRIBUTION_VARIABLE",
      "componentId": "distribution-variable",
      "label": "Dystrybucja zmienna"
    }
  ],
  "provider": {
    "id": "TAURON_DYSTRYBUCJA",
    "label": "TAURON Dystrybucja"
  },
  "operator": {
    "id": "TAURON_DYSTRYBUCJA",
    "label": "TAURON Dystrybucja"
  },
  "tariffGroup": "G11",
  "validFrom": null,
  "validTo": null,
  "currency": "PLN",
  "timezone": "Europe/Warsaw",
  "taxContext": {
    "jurisdiction": "PL",
    "customerClass": "HOUSEHOLD"
  },
  "inputs": [
    {
      "id": "distribution.rate.2025",
      "label": "Składnik zmienny dystrybucji 2025",
      "type": "DECIMAL",
      "required": true,
      "targets": [
        "/components/0/pricePeriods/0/rate/value"
      ],
      "unit": "PLN/kWh"
    },
    {
      "id": "distribution.rate.2026",
      "label": "Składnik zmienny dystrybucji 2026",
      "type": "DECIMAL",
      "required": true,
      "targets": [
        "/components/0/pricePeriods/1/rate/value"
      ],
      "unit": "PLN/kWh"
    }
  ],
  "billingDefinitionTemplate": {
    "version": 1,
    "currency": "PLN",
    "timezone": "Europe/Warsaw",
    "billingCycle": {
      "anchor": "2026-01-01",
      "length": 1,
      "unit": "MONTH"
    },
    "components": [
      {
        "id": "distribution-variable",
        "kind": "DISTRIBUTION_VARIABLE",
        "category": "NETWORK",
        "taxTreatment": {
          "included": []
        },
        "quantity": {
          "type": "ACTIVE_ENERGY_IMPORT",
          "strategy": "IMPORT_MINUS_EXPORT_CAP_ZERO",
          "periodInMinutes": 60
        },
        "selector": {
          "type": "ALWAYS"
        },
        "pricePeriods": [
          {
            "validFrom": null,
            "validTo": "2026-01-01T00:00:00+01:00",
            "rate": {
              "type": "CONSTANT",
              "value": "0.2541",
              "unit": "PLN/kWh"
            }
          },
          {
            "validFrom": "2026-01-01T00:00:00+01:00",
            "validTo": null,
            "rate": {
              "type": "CONSTANT",
              "value": "0.2464",
              "unit": "PLN/kWh"
            }
          }
        ]
      }
    ]
  },
  "warnings": [
    "Poza latami 2025–2026 stosowane są skrajne znane stawki. Zweryfikuj je na fakturze."
  ],
  "llmNotes": [
    "Przed 2025 r. oraz po 2026 r. stosowana jest odpowiednio pierwsza lub ostatnia znana cena. Wyliczenia poza udokumentowanym zakresem są przybliżone."
  ],
  "sources": [
    {
      "title": "Taryfa TAURON Dystrybucja na 2025 r. - stawki G",
      "url": "https://www.tauron-dystrybucja.pl/-/media/offer-documents/dystrybucja/archiwum-taryf/2025/taryfa-td_sa-na-rok-2025.ashx"
    },
    {
      "title": "Taryfa TAURON Dystrybucja na 2026 r.",
      "url": "https://www.tauron-dystrybucja.pl/-/media/offer-documents/dystrybucja/aktualna-taryfa/taryfa-tauron-dystrybucja-2026_ocr.ashx"
    }
  ]
}
