{
  "version": 1,
  "id": "PL.ENEA.CENY_DYNAMICZNE.DI12011227_G.KONSUMENT",
  "label": "ENEA - Ceny Dynamiczne (konsument)",
  "presetType": "OFFER",
  "components": [
    {
      "kind": "ENERGY_PURCHASE",
      "componentId": "energy-purchase",
      "label": "Energia czynna"
    },
    {
      "kind": "SUPPLIER_FIXED",
      "componentId": "supplier-fixed",
      "label": "Opłata handlowa"
    }
  ],
  "provider": {
    "id": "ENEA",
    "label": "ENEA"
  },
  "validFrom": "2026-07-01T00:00:00+02:00",
  "validTo": "2026-10-01T00:00:00+02:00",
  "currency": "PLN",
  "timezone": "Europe/Warsaw",
  "taxContext": {
    "jurisdiction": "PL",
    "customerClass": "HOUSEHOLD"
  },
  "inputs": [
    {
      "id": "energy.add",
      "label": "Stały składnik ceny energii",
      "type": "DECIMAL",
      "required": true,
      "targets": [
        "/components/0/pricePeriods/0/rate/add"
      ],
      "unit": "PLN/kWh",
      "help": "Zmień tylko wtedy, gdy umowa podaje inną wartość."
    },
    {
      "id": "supplier.fixed",
      "label": "Miesięczna opłata handlowa",
      "type": "DECIMAL",
      "required": true,
      "targets": [
        "/components/1/pricePeriods/0/rate/value"
      ],
      "unit": "PLN/month",
      "help": "Dostosuj opłatę do sposobu otrzymywania faktury i warunków umowy."
    }
  ],
  "billingDefinitionTemplate": {
    "version": 1,
    "currency": "PLN",
    "timezone": "Europe/Warsaw",
    "billingCycle": {
      "anchor": "2026-01-01",
      "length": 1,
      "unit": "MONTH"
    },
    "components": [
      {
        "id": "energy-purchase",
        "kind": "ENERGY_PURCHASE",
        "category": "ENERGY",
        "taxTreatment": {
          "included": [
            "EXCISE"
          ]
        },
        "quantity": {
          "type": "ACTIVE_ENERGY_IMPORT"
        },
        "selector": {
          "type": "ALWAYS"
        },
        "pricePeriods": [
          {
            "validFrom": null,
            "validTo": null,
            "rate": {
              "type": "REFERENCE",
              "source": "PL.TGE.FIXING1",
              "sourceUnit": "PLN/MWh",
              "multiplier": "0.001",
              "add": "0.0870",
              "unit": "PLN/kWh"
            }
          }
        ]
      },
      {
        "id": "supplier-fixed",
        "kind": "SUPPLIER_FIXED",
        "category": "SERVICE",
        "taxTreatment": {
          "included": [
            "VAT"
          ]
        },
        "quantity": {
          "type": "PERIOD",
          "period": "MONTH",
          "prorate": false
        },
        "pricePeriods": [
          {
            "validFrom": null,
            "validTo": null,
            "rate": {
              "type": "CONSTANT",
              "value": "9.99",
              "unit": "PLN/month"
            }
          }
        ]
      }
    ]
  },
  "warnings": [
    "Opłata handlowa: 9,99 zł brutto/mies. z e-fakturą, 22,29 zł z fakturą papierową; z magazynem energii może wynosić 0 zł.",
    "Sprawdź w umowie okres obowiązywania warunków tej oferty."
  ],
  "llmNotes": [
    "Cena energii: RDN Fixing I w naturalnej rozdzielczości publikacji TGE + akcyza 0,0050 PLN/kWh + składnik kosztowo-marżowy 0,0820 PLN/kWh, czyli add = 0,0870 PLN/kWh netto.",
    "Preset konsumencki zachowuje rzeczywisty profil poboru i nie stosuje prosumenckiego godzinowego bilansowania ani alokacji.",
    "Domyślna opłata handlowa 9,99 PLN brutto/mies. dla e-Faktury zawiera VAT; faktura papierowa kosztuje 22,29 PLN brutto/mies.; wariant z magazynem energii ma opłatę 0 PLN.",
    "Ta edycja cennika była oferowana od 01.07.2026 do 30.09.2026 i przewiduje 12-miesięczny okres warunków; ustaw okres CostPlan zgodnie z własną umową. Preset nie obejmuje dystrybucji.",
    "Cennik przewiduje regułę awaryjną na wypadek nieopublikowania ceny TGE. Ten fallback nie jest modelowany przez REFERENCE; przy brakujących danych kalkulator zgłosi błąd zamiast zgadywać cenę."
  ],
  "source": {
    "title": "Cennik Oferty Ceny Dynamiczne DI12011227_G od 01.07.2026 do 30.09.2026",
    "url": "https://www.enea.pl/media/9061/cennik-oferty-ceny-dynamicznedi12011227god-01072026-do-30092026pdf.pdf",
    "retrievedAt": "2026-09-24"
  }
}
